Repository Name,Repository URL,Default Branch,Star Count,Description,Update_date
pvsneslib,https://github.com/alekmaul/pvsneslib,master,687,"PVSnesLib : A small, open and free development kit for the Nintendo SNES",2023-11-21T10:36:37Z
deepMiner,https://github.com/deepwn/deepMiner,master,538,deepMiner webminer proxy (update for cryptoNight R),2023-11-07T12:46:50Z
OpenCL-Headers,https://github.com/KhronosGroup/OpenCL-Headers,main,620,Khronos OpenCL-Headers,2023-11-11T00:01:14Z
KTX-Software,https://github.com/KhronosGroup/KTX-Software,main,702,KTX (Khronos Texture) Library and Tools,2023-11-17T18:44:32Z
makefile2graph,https://github.com/lindenb/makefile2graph,master,570,Creates a graph of dependencies from GNU-Make;  Output is a graphiz-dot file or a Gexf-XML file.,2023-11-19T23:19:55Z
FastHook,https://github.com/turing-technician/FastHook,master,545,Android ART Hook,2023-11-20T09:15:47Z
dateutils,https://github.com/hroptatyr/dateutils,master,575,nifty command line date and time utilities; fast date calculations and conversion in the shell,2023-11-17T03:12:37Z
STMems_Standard_C_drivers,https://github.com/STMicroelectronics/STMems_Standard_C_drivers,master,631,"Platform-independent drivers for STMicroelectronics MEMS motion and environmental sensors, based on standard C programming language.",2023-11-21T16:05:03Z
esp8266ws2812i2s,https://github.com/cnlohr/esp8266ws2812i2s,master,531,ESP8266-based I2S-output WS2812(B) Driver,2023-11-18T16:45:27Z
sphinxbase,https://github.com/cmusphinx/sphinxbase,master,529,,2023-10-31T06:32:57Z
MultiplayerBook,https://github.com/MultiplayerBook/MultiplayerBook,master,589,,2023-11-19T00:55:15Z
jsource,https://github.com/jsoftware/jsource,master,595,J engine source mirror,2023-11-14T11:56:47Z
py-lmdb,https://github.com/jnwatson/py-lmdb,master,594,Universal Python binding for the LMDB 'Lightning' Database,2023-10-28T02:20:35Z
ESPUI,https://github.com/s00500/ESPUI,master,683,A simple web user interface library for ESP32 and ESP8266,2023-11-21T13:11:12Z
reliable,https://github.com/networkprotocol/reliable,master,551,A packet acknowledgement system for UDP,2023-11-20T13:44:10Z
MultiMarkdown-6,https://github.com/fletcher/MultiMarkdown-6,develop,573,"Lightweight markup processor to produce HTML, LaTeX, and more.",2023-11-16T07:48:00Z
php-amqp,https://github.com/php-amqp/php-amqp,latest,546,PHP extension to communicate with any AMQP compliant server,2023-10-26T19:24:49Z
BTLE,https://github.com/JiaoXianjun/BTLE,master,616,Bluetooth Low Energy (BLE) packet sniffer and transmitter for both standard and non standard (raw bit) based on Software Defined Radio (SDR).,2023-11-11T21:35:25Z
kernel-msm,https://github.com/MotorolaMobilityLLC/kernel-msm,kitkat-mr1-release-falcon-gpe,577,Linux Kernel for Motorola devices using MSM-based chipset,2023-11-10T01:11:25Z
3ds-hbmenu,https://github.com/devkitPro/3ds-hbmenu,master,620,The 3DS Homebrew Menu (∩ ͡° ͜ʖ ͡°)⊃━☆ﾟ ,2023-11-17T02:50:01Z
pure-ftpd,https://github.com/jedisct1/pure-ftpd,master,600,Pure FTP server,2023-11-17T11:30:23Z
iot-edge-v1,https://github.com/Azure/iot-edge-v1,master,527,Azure IoT Edge,2023-11-07T12:42:11Z
HellsGate,https://github.com/am0nsec/HellsGate,master,744,Original C Implementation of the Hell's Gate VX Technique,2023-11-20T14:46:13Z
daily,https://github.com/pexcn/daily,master,565,Poetry and far afield. 🌊,2023-11-15T14:10:39Z
wmd,https://github.com/mkusner/wmd,master,530,"Word Mover's Distance from Matthew J Kusner's paper ""From Word Embeddings to Document Distances""",2023-10-31T06:46:59Z
DroneBridge,https://github.com/DroneBridge/DroneBridge,master,638,"DroneBridge is a system based on the WifiBroadcast approach. A bidirectional digital radio link between two endpoints is established using standard WiFi hardware and a custom protocol. DroneBridge is optimized for use in UAV applications and is a complete system. It is intended be a real alternative to other similar systems, such as DJI Lightbridge or OcuSync.",2023-11-11T16:54:03Z
rtems,https://github.com/RTEMS/rtems,master,590,"Realtime SMP Kernel, networking, file-systems, drivers, BSPs, samples, and testsuite.",2023-11-22T05:55:59Z
fruitstrap,https://github.com/ghughes/fruitstrap,master,531,"Install and debug iPhone apps from the command line, without using Xcode",2023-10-22T22:57:28Z
TL-BOTS,https://github.com/threatland/TL-BOTS,master,534,A collection of source code for various botnets.,2023-11-20T23:23:26Z
SSVOpenHexagon,https://github.com/vittorioromeo/SSVOpenHexagon,master,594,"C++20 FOSS clone of ""Super Hexagon"". Depends on SSVStart, SSVEntitySystem, SSVLuaWrapper, SSVMenuSystem, JSONcpp, SFML2.0. Features JSON/LUA customizable game files, a soundtrack by BOSSFIGHT, pseudo-3D effects.",2023-11-14T18:00:48Z
opensbi,https://github.com/riscv-software-src/opensbi,master,798,RISC-V Open Source Supervisor Binary Interface,2023-11-21T13:20:32Z
houdini,https://github.com/vmg/houdini,master,528,The Escapist,2023-10-23T07:47:01Z
VAC,https://github.com/danielkrupinski/VAC,master,653,Source code of Valve Anti-Cheat obtained from disassembly of compiled modules,2023-11-21T08:52:47Z
ngx_postgres,https://github.com/FRiCKLE/ngx_postgres,master,533,upstream module that allows nginx to communicate directly with PostgreSQL database. ,2023-10-19T05:55:53Z
argparse,https://github.com/cofyc/argparse,master,598,Command-line arguments parsing library.,2023-11-21T20:44:00Z
openwrt,https://github.com/openwrt-mirror/openwrt,master,527,Mirror of the OpenWRT repository,2023-11-19T13:06:34Z
esp32-ble2mqtt,https://github.com/shmuelzon/esp32-ble2mqtt,master,617,A BLE to MQTT bridge running on an ESP32,2023-11-17T19:05:13Z
quicly,https://github.com/h2o/quicly,master,574,A modular QUIC stack designed primarily for H2O,2023-11-17T10:09:56Z
ptSh,https://github.com/jszczerbinsky/ptSh,main,533,Visually customizable shell utils,2023-11-11T04:11:04Z
vsmartcard,https://github.com/frankmorgner/vsmartcard,master,624,umbrella project for emulation of smart card readers or smart cards,2023-11-19T21:35:54Z
zint-gpl-only,https://github.com/zint/zint-gpl-only,master,525,Zint Barcode Generator,2023-11-01T15:45:32Z
daala,https://github.com/xiph/daala,master,533,Modern video compression for the internet,2023-11-18T18:01:55Z
humble-video,https://github.com/artclarke/humble-video,master,542,"Humble Video: Demuxing, Decoding, Filtering, Encoding and Muxing of 100's of video and audio formats and Codecs from the JVM",2023-11-22T05:12:53Z
ccextractor,https://github.com/CCExtractor/ccextractor,master,622,CCExtractor - Official version maintained by the core team,2023-11-21T17:52:54Z
daemonize,https://github.com/bmc/daemonize,master,537,Command line utility to run a program as a Unix daemon,2023-10-21T03:53:29Z
LOGITacker,https://github.com/RoganDawes/LOGITacker,master,600,Enumerate and test Logitech wireless input devices for vulnerabilities with a nRF52840 radio dongle.,2023-11-19T04:09:03Z
escape_utils,https://github.com/brianmario/escape_utils,master,518,Faster string escaping routines for your ruby apps,2023-10-23T11:02:02Z
Ingredients,https://github.com/atg/Ingredients,master,516,A Cocoa documentation viewer.,2023-09-08T16:26:16Z
plibsys,https://github.com/saprykin/plibsys,master,598,"Highly portable C system library: threads and synchronization primitives, sockets (TCP, UDP, SCTP), IPv4 and IPv6, IPC, hash functions (MD5, SHA-1, SHA-2, SHA-3, GOST), binary trees (RB, AVL) and more. Native code performance.",2023-11-19T17:40:10Z
blockparser,https://github.com/znort987/blockparser,master,525,Simple C++ bitcoin blockchain parser,2023-11-22T01:32:51Z
linux.mirai,https://github.com/0x27/linux.mirai,master,543,Leaked Linux.Mirai Source Code for Research/IoC Development Purposes,2023-11-20T14:45:29Z
Ext3Fsd,https://github.com/matt-wu/Ext3Fsd,master,627,Ext2/3/4 file system driver for Windows,2023-11-19T15:13:16Z
OpenGL-Registry,https://github.com/KhronosGroup/OpenGL-Registry,main,604,"OpenGL, OpenGL ES, and OpenGL ES-SC API and Extension Registry",2023-11-14T21:53:05Z
azure-iot-sdk-c,https://github.com/Azure/azure-iot-sdk-c,main,558,A C99 SDK for connecting devices to Microsoft Azure IoT services,2023-11-15T01:41:28Z
CTF-Workshop,https://github.com/kablaa/CTF-Workshop,master,565,Challenges for Binary Exploitation Workshop,2023-11-21T12:18:29Z
json.h,https://github.com/sheredom/json.h,master,633,🗄️ single header json parser for C and C++,2023-11-07T06:22:31Z
DotNetAnywhere,https://github.com/chrisdunelm/DotNetAnywhere,master,536,Small .NET interpreter,2023-10-31T09:59:50Z
C,https://github.com/yaouser/C,master,533,linux下的C语言及关于kernel的介绍,2023-11-21T08:45:53Z
AndroidKernelExploitationPlayground,https://github.com/Fuzion24/AndroidKernelExploitationPlayground,master,531,,2023-11-21T09:39:46Z
lazycast,https://github.com/homeworkc/lazycast,master,639,A Simple Wireless Display Receiver,2023-11-18T12:04:27Z
libsqlfs,https://github.com/guardianproject/libsqlfs,master,569,a library that implements a POSIX style filesystem on top of an SQLite database,2023-11-05T19:16:20Z
ICSim,https://github.com/zombieCraig/ICSim,master,671,Instrument Cluster Simulator,2023-11-22T01:21:54Z
SipHash,https://github.com/veorq/SipHash,master,583,High-speed secure pseudorandom function for short messages ,2023-11-12T13:35:12Z
zork,https://github.com/devshane/zork,master,563,The DUNGEON (Zork I) source,2023-11-21T06:05:00Z
mooltipass,https://github.com/limpkin/mooltipass,master,519,Github repository dedicated to the mooltipass project,2023-10-22T22:53:47Z
files,https://github.com/phoenhex/files,master,522,,2023-11-20T16:52:30Z
javy,https://github.com/Shopify/javy,main,1666,JS to WebAssembly toolchain,2023-11-21T16:20:29Z
CMock,https://github.com/ThrowTheSwitch/CMock,master,601,CMock - Mock/stub generator for C,2023-11-20T13:13:56Z
gl4es,https://github.com/ptitSeb/gl4es,master,618,"GL4ES is a OpenGL 2.1/1.5 to GL ES 2.0/1.1 translation library, with support for Pandora, ODroid, OrangePI, CHIP, Raspberry PI, Android, Emscripten and AmigaOS4.",2023-11-20T10:18:39Z
gnupg,https://github.com/gpg/gnupg,master,616,"The GNU Privacy Guard. NOTE: Maintainers are not tracking this mirror. Do not make pull requests here, nor comment any commits, submit them usual way to bug tracker (https://www.gnupg.org/documentation/bts.html) or to the mailing list (https://www.gnupg.org/documentation/mailing-lists.html).",2023-11-21T15:04:22Z
DsHidMini,https://github.com/ViGEm/DsHidMini,master,900,Virtual HID Mini-user-mode-driver for Sony DualShock 3 Controllers,2023-11-22T01:19:28Z
MJCodeObfuscation,https://github.com/CoderMJLee/MJCodeObfuscation,master,561,一个用于代码混淆和字符串加密的Mac小Demo,2023-11-16T08:16:28Z
EasyAVR,https://github.com/dhowland/EasyAVR,master,530,Easy AVR USB Keyboard Firmware and Keymapper,2023-11-22T05:09:29Z
md4c,https://github.com/mity/md4c,master,643,C Markdown parser. Fast. SAX-like interface. Compliant to CommonMark specification.,2023-11-18T05:11:51Z
xst,https://github.com/gnotclub/xst,master,533,st fork that uses Xresources and some pretty good patches,2023-10-09T12:40:42Z
brightness,https://github.com/nriley/brightness,master,558,Command-line display brightness control for macOS.,2023-11-20T12:03:04Z
kerf1,https://github.com/kevinlawler/kerf1,master,534,"Kerf (Kerf1) is a columnar tick database and time-series language for Linux/OSX/BSD/iOS/Android. It is written in C and natively speaks JSON and SQL. Kerf can be used for trading platforms, feedhandlers, low-latency networking, high-volume analysis of realtime and historical data, logfile processing, and more.",2023-11-11T00:03:31Z
GtkRadiant,https://github.com/TTimo/GtkRadiant,1.6-release,557,"The open source, cross platform level editor for idtech games",2023-11-22T01:49:59Z
OneFileLinux,https://github.com/zhovner/OneFileLinux,master,566,Live linux distro combined in one ~20MB file. Runs on any UEFI computer.,2023-11-08T19:20:33Z
GIMX,https://github.com/matlo/GIMX,master,551,The GIMX software.,2023-10-25T09:37:24Z
bedrocklinux-userland,https://github.com/bedrocklinux/bedrocklinux-userland,master,576,This tracks development for the things such as scripts and (defaults for) config files for Bedrock Linux,2023-11-16T20:40:58Z
test-tlb,https://github.com/torvalds/test-tlb,master,621,Stupid memory latency and TLB tester,2023-11-19T16:49:55Z
PFQ,https://github.com/pfq/PFQ,master,514,Functional Network Framework for Multi-Core Architectures,2023-09-28T10:19:29Z
libsrt,https://github.com/faragon/libsrt,master,536,"libsrt is a C library for writing fast and safe C code, faster. It provides string, vector, bit set, set, map, hash set, and hash map handling. Suitable for soft and hard real-time. Allows both heap and stack allocation.  *BETA* (API still can change: suggestions are welcome)",2023-11-16T08:29:02Z
2018AICity_TeamUW,https://github.com/zhengthomastang/2018AICity_TeamUW,master,544,The winning method in Track 1 and Track 3 at the 2nd AI City Challenge Workshop in CVPR 2018 - Official Implementation,2023-10-31T14:48:24Z
ui,https://github.com/krakjoe/ui,develop,515,Cross platform UI development in PHP,2023-11-20T18:45:07Z
vedis,https://github.com/symisc/vedis,master,525,An Embedded Implementation of Redis,2023-11-22T03:11:57Z
PSn00bSDK,https://github.com/Lameguy64/PSn00bSDK,master,696,The most powerful open source SDK for the PS1 (as far as open source PS1 SDKs go). Not recommended for beginner use.,2023-11-20T19:25:31Z
purr-data,https://github.com/agraef/purr-data,master,584,Purr Data - Jonathan Wilkes' cross-platform Pd-l2ork version,2023-11-13T23:40:28Z
libguestfs,https://github.com/libguestfs/libguestfs,master,576,library and tools for accessing and modifying virtual machine disk images.  PLEASE DO NOT USE GITHUB FOR ISSUES OR PULL REQUESTS.  See the website for how to file a bug or contact us.,2023-11-12T15:15:50Z
PR0CESS,https://github.com/aaaddress1/PR0CESS,main,561,some gadgets about windows process and ready to use :),2023-11-21T21:07:53Z
astrometry.net,https://github.com/dstndstn/astrometry.net,main,611,Astrometry.net -- automatic recognition of astronomical images,2023-11-15T16:09:31Z
mintomic,https://github.com/mintomic/mintomic,master,512,"[deprecated] For native C atomics, see Turf instead",2023-10-08T08:25:55Z
AltServer-Linux,https://github.com/NyaMisty/AltServer-Linux,new,844,"AltServer for AltStore, but on-device",2023-11-20T14:31:55Z
sipdroid,https://github.com/i-p-tel/sipdroid,master,589,Free SIP/VoIP client for Android,2023-11-18T18:44:50Z
alilua,https://github.com/oneoo/alilua,master,530,epoll/kqueue+lua based web server,2023-11-15T12:41:50Z
rds_dbsync,https://github.com/aliyun/rds_dbsync,master,531,"围绕 PostgreSQL Greenplum ,实现易用的数据的互迁功能项目",2023-11-01T05:43:38Z
kallisto,https://github.com/pachterlab/kallisto,master,595,Near-optimal RNA-Seq quantification,2023-11-13T17:10:50Z
extension-manager,https://github.com/mjakeman/extension-manager,master,805,A utility for browsing and installing GNOME Shell Extensions.,2023-11-21T18:43:53Z
archived_madlib,https://github.com/madlib/archived_madlib,placeholder,511,MADlib has moved to Apache MADlib (incubating). Please send pull requests to the Apache repository. ,2023-07-19T19:58:28Z
silentcast,https://github.com/colinkeenan/silentcast,master,511,Create silent mkv screencast and animated gif.,2023-09-08T12:53:59Z
inclavare-containers,https://github.com/inclavare-containers/inclavare-containers,master,557,"A novel container runtime, aka confidential container, for cloud-native confidential computing and enclave runtime ecosystem.",2023-11-19T09:32:01Z
2048.c,https://github.com/mevdschee/2048.c,main,552,"Console version of the game ""2048"" for GNU/Linux",2023-11-03T07:37:40Z
doomretro,https://github.com/bradharding/doomretro,master,600,"The classic, refined DOOM source port. For Windows PC.",2023-11-21T04:55:20Z
Impost3r,https://github.com/ph4ntonn/Impost3r,master,577,👻Impost3r -- A linux password thief,2023-11-21T06:20:58Z
MultiTimer,https://github.com/0x1abin/MultiTimer,development,693,Software timers extend module for embedded,2023-11-21T09:03:07Z
neko,https://github.com/HaxeFoundation/neko,master,530,The Neko Virtual Machine,2023-11-21T18:07:08Z
SoftRF,https://github.com/lyusupov/SoftRF,master,643,":airplane:  Multi-functional, compatible DIY general aviation proximity awareness system",2023-11-21T14:06:31Z
s6_pcie_microblaze,https://github.com/Cr4sh/s6_pcie_microblaze,master,640,"PCI Express DIY hacking toolkit for Xilinx SP605. This repository is also home of Hyper-V Backdoor and Boot Backdoor, check readme for links and info",2023-11-20T14:45:39Z
Enemy-Territory,https://github.com/id-Software/Enemy-Territory,master,532,Wolfenstein: Enemy Territory GPL Source Release,2023-10-20T03:16:25Z
SGX-hardware,https://github.com/ayeks/SGX-hardware,master,548,This is a list of hardware which supports Intel SGX - Software Guard Extensions. ,2023-11-20T15:20:16Z
AES,https://github.com/dhuertas/AES,master,573,AES algorithm implementation in C,2023-11-17T16:40:17Z
swappy,https://github.com/jtheoof/swappy,master,756,"A Wayland native snapshot editing tool, inspired by Snappy on macOS",2023-11-21T08:40:38Z
php-ext-trie-filter,https://github.com/wulijun/php-ext-trie-filter,master,516,"php extension for spam word filter based on Double-Array Trie tree, it can detect if a spam word exists in a text message. 关键词过滤扩展，用于检查一段文本中是否出现敏感词，基于Double-Array Trie 树实现。",2023-09-21T12:22:52Z
dbus-broker,https://github.com/bus1/dbus-broker,main,581,Linux D-Bus Message Broker,2023-11-21T19:06:06Z
morris-worm,https://github.com/arialdomartini/morris-worm,master,559,The decompiled Morris Worm source code,2023-11-22T08:43:38Z
HadesFCS,https://github.com/pms67/HadesFCS,master,633,Complete flight control system designed from scratch. Hardware designed with KiCad.,2023-11-20T18:48:23Z
ESP32_CAMERA_QR,https://github.com/donny681/ESP32_CAMERA_QR,master,584,,2023-11-21T15:15:54Z
386bsd,https://github.com/386bsd/386bsd,2.0,555,386BSD,2023-11-21T14:21:33Z
sol,https://github.com/rsms/sol,master,514,A sunny little virtual machine,2023-11-06T15:18:53Z
hlsdl,https://github.com/selsta/hlsdl,master,585,C program to download VoD HLS (.m3u8) files,2023-11-21T09:08:49Z
IAPKit,https://github.com/gohypergiant/IAPKit,master,502,"A simple approach to Apple In App Purchases (IAP) that handles the presentation of products, purchasing, receipt validation, and timed free trials.",2023-11-19T09:27:30Z
mynewt-nimble,https://github.com/apache/mynewt-nimble,master,596,Apache mynewt,2023-11-22T05:26:51Z
dnscrypt-wrapper,https://github.com/cofyc/dnscrypt-wrapper,master,519,"This is dnscrypt wrapper (server-side dnscrypt proxy), which helps to add dnscrypt support to any name resolver.",2023-11-16T20:25:52Z
xash3d,https://github.com/FWGS/xash3d,master,537,DEPRECATED in favor of https://github.com/FWGS/xash3d-fwgs. Only bugfixes are accepted.,2023-11-18T06:46:55Z
QuickJS,https://github.com/ldarren/QuickJS,mod,533,QuickJS is a small and embeddable Javascript engine. QuickJS sources are copyright Fabrice Bellard and Charlie Gordon.,2023-10-22T13:39:33Z
MIRACL,https://github.com/miracl/MIRACL,master,597,MIRACL Cryptographic SDK: Multiprecision Integer and Rational Arithmetic Cryptographic Library is a C software library that is widely regarded by developers as the gold standard open source SDK for elliptic curve cryptography (ECC).,2023-11-21T11:39:45Z
frida-gum,https://github.com/frida/frida-gum,main,629,Cross-platform instrumentation and introspection library written in C,2023-11-21T02:53:04Z
x11vnc,https://github.com/LibVNC/x11vnc,master,621,a VNC server for real X displays,2023-11-21T15:22:14Z
c,https://github.com/justin-lathrop/c,master,610,C Programming Projects,2023-11-21T16:58:08Z
esp-apple-homekit-adk,https://github.com/espressif/esp-apple-homekit-adk,master,587,This is a port for Apple's Open Source HomeKit ADK,2023-11-15T01:49:13Z
ympd,https://github.com/notandy/ympd,master,511,"Standalone MPD Web GUI written in C, utilizing Websockets and Bootstrap/JS",2023-11-09T11:14:12Z
kazmath,https://github.com/Kazade/kazmath,master,512,A C math library targeted at games,2023-11-08T09:40:20Z
CVE-2022-23222,https://github.com/tr3ee/CVE-2022-23222,master,551,CVE-2022-23222: Linux Kernel eBPF Local Privilege Escalation,2023-11-07T18:53:39Z
Mini-DSO,https://github.com/CreativeLau/Mini-DSO,master,566,用STC单片机制作的简易示波器 / DIY Mini Digital Storage Oscilloscopes(DSO) with STC MCU,2023-11-15T10:12:58Z
dpt-tools,https://github.com/HappyZ/dpt-tools,master,538,dpt systems study and enhancement,2023-11-13T14:36:37Z
simple2d,https://github.com/simple2d/simple2d,main,554,":video_game: Simple, open-source 2D graphics for everyone",2023-11-21T11:09:20Z
rogauracore,https://github.com/wroberts/rogauracore,master,609,RGB keyboard control for Asus ROG laptops,2023-11-21T21:33:58Z
nniefacelib,https://github.com/hanson-young/nniefacelib,master,543,nniefacelib是一个在海思35xx系列芯片上运行的人脸算法库,2023-11-15T08:20:39Z
linux-exploit-development-tutorial,https://github.com/hardenedlinux/linux-exploit-development-tutorial,master,529,a series tutorial for linux exploit development to newbie.,2023-10-19T01:49:43Z
redis_source_annotation,https://github.com/menwenjun/redis_source_annotation,master,514,redis 3.2.8 的源码注释,2023-11-08T08:26:08Z
gf,https://github.com/nakst/gf,master,1184,A GDB frontend for Linux.,2023-11-21T11:56:25Z
iSCSIInitiator,https://github.com/iscsi-osx/iSCSIInitiator,master,536,iSCSI Initiator for macOS,2023-11-06T17:34:02Z
openbox,https://github.com/danakj/openbox,master,565,Openbox Window Manager (OpenboxWM),2023-11-20T02:49:50Z
Pentest,https://github.com/Ridter/Pentest,master,526,tools,2023-10-31T04:51:45Z
FlexBoxLayout,https://github.com/carlSQ/FlexBoxLayout,develop,525,iOS Flexbox Layout.,2023-10-16T08:32:39Z
Scan-T,https://github.com/nanshihui/Scan-T,master,509,a new crawler based on python with more function including Network fingerprint search,2023-10-18T12:28:10Z
lldpd,https://github.com/lldpd/lldpd,master,552,implementation of IEEE 802.1ab (LLDP),2023-11-09T08:42:54Z
tslib,https://github.com/libts/tslib,master,559,Touchscreen access library,2023-11-10T01:51:39Z
LuaScriptCore,https://github.com/vimfung/LuaScriptCore,master,512,一款简单易用的多平台Lua桥接器，目前支持在iOS、Mac OS X、Android以及Unity3D中使用，让原生环境与Lua无障碍沟通。,2023-10-10T01:22:06Z
CAMotics,https://github.com/CauldronDevelopmentLLC/CAMotics,master,554,Open-Source Simulation & Computer Aided Machining - A 3-axis CNC GCode simulator,2023-11-05T15:43:35Z
STM32CubeF4,https://github.com/STMicroelectronics/STM32CubeF4,master,712,"STM32Cube MCU Full Package for the STM32F4 series - (HAL + LL Drivers, CMSIS Core, CMSIS Device, MW libraries plus a set of Projects running on all boards provided by ST (Nucleo, Evaluation and Discovery Kits))",2023-11-22T08:29:54Z
build_xlua_with_libs,https://github.com/chexiongsheng/build_xlua_with_libs,master,552,为xLua集成几个常用库，方便使用,2023-11-18T10:17:48Z
mitnal,https://github.com/arata-nvm/mitnal,master,510,Twitter client for UEFI,2023-11-19T04:29:01Z
compress-images,https://github.com/Yuriy-Svetlov/compress-images,master,567,"Minify size your images. Image compression with extension: jpg/jpeg, svg, png, gif. NodeJs",2023-10-31T01:27:41Z
KeepAlive,https://github.com/lcodecorex/KeepAlive,master,554,Fighting against force-stop kill process on Android with binder ioctl / Android高级保活,2023-11-18T04:04:02Z
RTCW-SP,https://github.com/id-Software/RTCW-SP,master,534,Return to Castle Wolfenstein Single Player GPL Source Release,2023-10-30T16:12:54Z
GPGOAP,https://github.com/stolk/GPGOAP,master,533,General Purpose Goal Oriented Action Planning,2023-11-18T15:18:14Z
gideros,https://github.com/gideros/gideros,master,531,Gideros Release version,2023-11-15T08:16:17Z
AceLdr,https://github.com/kyleavery/AceLdr,main,736,Cobalt Strike UDRL for memory scanner evasion.,2023-11-20T14:47:12Z
map,https://github.com/rxi/map,master,542,A type-safe hash map implementation for C,2023-11-16T08:25:18Z
subversion,https://github.com/apache/subversion,trunk,533,Mirror of Apache Subversion,2023-11-04T16:06:41Z
slre,https://github.com/cesanta/slre,master,512,Super Light Regexp engine for C/C++,2023-10-21T01:28:03Z
process_ghosting,https://github.com/hasherezade/process_ghosting,master,569,"Process Ghosting - a PE injection technique, similar to Process Doppelgänging, but using a delete-pending file instead of a transacted file",2023-11-21T02:15:58Z
libremarkable,https://github.com/canselcik/libremarkable,master,565,The only public framework for developing applications with native refresh support for Remarkable Tablet,2023-11-14T17:55:20Z
syscall_intercept,https://github.com/pmem/syscall_intercept,master,563,The system call intercepting library,2023-11-16T07:26:30Z
tiny-compiler,https://github.com/zakirullin/tiny-compiler,master,528,"A tiny compiler for a language featuring LL(2) with Lexer, Parser, ASM-like codegen and VM. Complex enough to give you a flavour of how the ""real"" thing works whilst not being a mere toy example",2023-11-20T03:44:55Z
annotated_nginx,https://github.com/chronolaw/annotated_nginx,master,558,Annotated Nginx Source（中文）,2023-11-19T08:10:22Z
ofxDarknet,https://github.com/schwittlick/ofxDarknet,master,496,darknet neural network addon for openFrameworks,2023-11-17T15:50:12Z
geany-plugins,https://github.com/geany/geany-plugins,master,552,The combined Geany Plugins collection,2023-11-10T22:50:17Z
kirc,https://github.com/mcpcpc/kirc,master,511,A tiny IRC client written in POSIX C99.,2023-11-15T00:57:48Z
DirtyPipe-Android,https://github.com/polygraphene/DirtyPipe-Android,master,678,Dirty Pipe root exploit for Android (Pixel 6),2023-11-22T05:00:03Z
