Repository Name,Repository URL,Default Branch,Star Count,Description,Update_date
ngx_zeromq,https://github.com/FRiCKLE/ngx_zeromq,master,265,ZeroMQ transport for nginx,2023-09-08T16:31:42Z
imcat,https://github.com/stolk/imcat,master,308,Show any image in a terminal window.,2023-11-20T22:43:16Z
rxTools,https://github.com/roxas75/rxTools,master,266,rxTools,2023-11-21T15:43:32Z
bruteforce-wallet,https://github.com/glv2/bruteforce-wallet,master,311,"Try to find the password of an encrypted Peercoin (or Bitcoin, Litecoin, etc...) wallet file.",2023-11-18T15:54:21Z
DeepSleep,https://github.com/thefLink/DeepSleep,main,317,A variant of Gargoyle for x64 to hide memory artifacts using ROP only and PIC,2023-11-20T14:47:03Z
reacTIVision,https://github.com/mkalten/reacTIVision,master,290,computer vision framework for tangible interactive surfaces,2023-11-04T18:28:38Z
librtmp,https://github.com/yixia/librtmp,master,262,librtmp for Android  and iOS,2023-11-06T09:44:09Z
es-shell,https://github.com/wryun/es-shell,master,291,es: a shell with higher-order functions,2023-11-06T21:42:20Z
icecast-kh,https://github.com/karlheyes/icecast-kh,master,286,KH branch of icecast,2023-09-28T02:09:05Z
netelf,https://github.com/XiphosResearch/netelf,master,276,"Run executables from memory, over the network, on Windows, Linux, OpenVMS... routers... spaceships... toasters etc.",2023-09-28T10:35:53Z
magic,https://github.com/RTimothyEdwards/magic,master,385,Magic VLSI Layout Tool,2023-11-21T14:15:59Z
rxtx,https://github.com/rxtx/rxtx,development,298,rxtx - a Java cross platform wrapper library for the serial port,2023-11-13T02:28:44Z
Byzantium,https://github.com/Byzantium/Byzantium,master,263,Configs and code for Project Byzantium.,2023-11-16T08:21:35Z
basicstation,https://github.com/lorabasics/basicstation,master,313,LoRa Basics™ Station - The LoRaWAN Gateway Software,2023-11-19T06:57:53Z
lsof,https://github.com/lsof-org/lsof,master,337,LiSt Open Files,2023-11-22T09:22:23Z
io_uring-by-example,https://github.com/shuveb/io_uring-by-example,master,338,A companion repository for the io_uring by Example article series,2023-11-17T11:28:19Z
cydownload,https://github.com/borishonman/cydownload,master,315,,2023-11-13T23:45:19Z
startc,https://github.com/marssaxman/startc,master,266,minimal freestanding C library for bare-metal i386 development,2023-05-07T13:39:35Z
Rserve,https://github.com/s-u/Rserve,master,272,"Fast, flexible and powerful server providing access to R from many languages and systems",2023-10-10T19:33:57Z
speech-denoiser,https://github.com/lucianodato/speech-denoiser,master,279,A speech denoise lv2 plugin based on RNNoise library,2023-11-18T23:11:12Z
ini,https://github.com/rxi/ini,master,299,A tiny ANSI C library for loading .ini config files,2023-11-16T09:30:34Z
mistserver,https://github.com/DDVTECH/mistserver,master,316,The official mistserver source repository - www.mistserver.com,2023-11-21T03:13:14Z
8814au,https://github.com/morrownr/8814au,main,388,Linux Driver for USB WiFi Adapters that are based on the RTL8814AU Chipset,2023-11-15T08:19:59Z
maxcso,https://github.com/unknownbrackets/maxcso,master,339,Fast cso compressor,2023-11-17T19:19:12Z
rtl_tcp_andro-,https://github.com/signalwareltd/rtl_tcp_andro-,master,305,rtl_tcp and libusb-1.0 port for Android modified to support opening devices from Linux file descriptors,2023-11-21T01:40:38Z
PiP,https://github.com/amitv87/PiP,master,363,macOS Picture in Picture and AirPlay Receiver,2023-11-16T08:30:38Z
plb,https://github.com/attractivechaos/plb,master,269,Programming language benchmarks,2023-09-08T16:29:11Z
optparse,https://github.com/skeeto/optparse,master,302,"Portable, reentrant, getopt-like option parser",2023-10-29T17:47:07Z
keyless,https://github.com/cloudflare/keyless,master,274,Cloudflare's Keyless SSL Server Reference Implementation,2023-11-01T05:53:43Z
Adafruit_TinyUSB_Arduino,https://github.com/adafruit/Adafruit_TinyUSB_Arduino,master,382,Arduino library for TinyUSB,2023-11-19T19:38:06Z
openocd-esp32,https://github.com/espressif/openocd-esp32,master,318,OpenOCD branch with ESP32 JTAG support,2023-11-02T11:50:31Z
android-ffmpeg-tutorial,https://github.com/roman10/android-ffmpeg-tutorial,master,258,android-ffmpeg-tutorial,2023-11-17T02:46:00Z
esp8266-devkit,https://github.com/CHERTS/esp8266-devkit,master,259,Unofficial Development Kit for Espressif ESP8266,2023-10-10T00:11:15Z
vim,https://github.com/b4winckler/vim,master,258,Mirror of the Vim Mercurial repository,2023-08-10T14:14:00Z
blue-sky,https://github.com/VaughnValle/blue-sky,master,318,A clean and blue BSPWM setup,2023-11-11T17:21:04Z
libjson,https://github.com/vincenthz/libjson,master,270,a JSON parser and printer library in C. easy to integrate with any model.,2023-10-23T15:38:29Z
ogg,https://github.com/xiph/ogg,master,318,Reference implementation of the Ogg media container,2023-11-20T02:25:29Z
The-Modern-Cpp-Challenge,https://github.com/PacktPublishing/The-Modern-Cpp-Challenge,master,286,"The Modern C++ Challenge, published by Packt",2023-10-27T01:53:25Z
c-blosc2,https://github.com/Blosc/c-blosc2,main,372,"A fast, compressed, persistent binary data store library for C.",2023-11-11T07:34:08Z
nsimd,https://github.com/agenium-scale/nsimd,master,306,Agenium Scale vectorization library for CPUs and GPUs,2023-11-14T02:49:08Z
flower,https://github.com/diyruz/flower,master,342,DIY Zigbee flower sensor,2023-11-22T07:51:52Z
hugula,https://github.com/tenvick/hugula,master,270,unity3d lua databinding mvvm ,2023-10-14T11:03:32Z
rw_socket_driver,https://github.com/adrianyy/rw_socket_driver,master,348,Driver that uses network sockets to communicate with client and read/ write protected process memory.,2023-11-21T16:19:17Z
fruitymesh,https://github.com/mwaylabs/fruitymesh,master,279,FruityMesh - The first completely connection-based open source mesh on top of Bluetooth Low Energy (4.1/5.0 or higher),2023-10-23T12:22:26Z
gst-rpicamsrc,https://github.com/thaytan/gst-rpicamsrc,master,262,GStreamer element for the Raspberry Pi camera module,2023-06-16T21:19:39Z
osxinj,https://github.com/scen/osxinj,master,293,osx dylib injection,2023-11-12T06:20:35Z
ndk_dlopen,https://github.com/Rprop/ndk_dlopen,master,287,a lightweight ndk utility that helps to bypass Android N's classloader-namespace restriction,2023-11-13T16:51:09Z
otree,https://github.com/antirez/otree,master,270,a simple btree implementation with automatic space reclaiming,2023-11-18T03:52:32Z
libpopcnt,https://github.com/kimwalisch/libpopcnt,master,286,🚀 Fast C/C++ bit population count library,2023-10-18T19:40:43Z
pcompress,https://github.com/moinakg/pcompress,master,270,A Parallelized Data Deduplication and Compression utility,2023-08-25T09:11:06Z
c-programming-a-modern-approach,https://github.com/fordea/c-programming-a-modern-approach,master,292,"Solutions to exercises and projects in the textbook C Programming: A Modern Approach, 2nd Edition.",2023-11-19T21:22:54Z
fast-wait-free-queue,https://github.com/chaoran/fast-wait-free-queue,master,272,A benchmark framework for concurrent queue implementations,2023-11-01T12:09:54Z
PicoMemcard,https://github.com/dangiu/PicoMemcard,pmc+/release,447,Emulating PSX Memory Card (or controller) using a Raspberry Pi Pico,2023-11-19T11:29:49Z
minimp4,https://github.com/lieff/minimp4,master,308,Minimalistic MP4 mux/demux single header library ,2023-11-08T14:41:59Z
geoipupdate-legacy,https://github.com/maxmind/geoipupdate-legacy,master,259,GeoIP update client code,2023-08-23T08:47:21Z
CS50-intro-course,https://github.com/Federico-abss/CS50-intro-course,master,292,Harvard's cs50: Introduction To CS 2020 - solutions to every pset plus final project!,2023-11-11T00:18:23Z
continuity,https://github.com/furiousMAC/continuity,master,397,Apple Continuity Protocol Reverse Engineering and Dissector,2023-11-21T21:40:29Z
libuavcan,https://github.com/OpenCyphal-Garage/libuavcan,main,273,Portable reference implementation of the Cyphal protocol stack in C++ for embedded systems and Linux.,2023-10-20T06:50:41Z
webby,https://github.com/deplinenoise/webby,master,268,A tiny webserver for game development,2023-11-21T10:36:34Z
artificial-nose,https://github.com/kartben/artificial-nose,master,320,"Instructions, source code, and misc. resources needed for building a Tiny ML-powered artificial nose.",2023-11-21T03:48:21Z
fortune-mod,https://github.com/shlomif/fortune-mod,master,353,"Implementation of the Unix fortune command for displaying a random quotation, for Linux and other systems.",2023-11-15T10:23:31Z
pg_rman,https://github.com/ossc-db/pg_rman,master,299,Backup and restore management tool for PostgreSQL,2023-11-06T08:02:58Z
VIKIROOT,https://github.com/hyln9/VIKIROOT,master,260,CVE-2016-5195 (Dirty COW) PoC for Android 6.0.1 Marshmallow,2023-11-18T13:36:47Z
OS-ARM,https://github.com/DDeGonge/OS-ARM,main,386,,2023-11-22T02:44:34Z
libxmp,https://github.com/libxmp/libxmp,master,287,Libxmp is a library that renders module files to PCM data.,2023-11-04T08:13:08Z
Spin,https://github.com/nimble-code/Spin,master,308,Explicit state logic model checking tool -- 2002 winner of the ACM System Software Award.,2023-11-04T05:15:18Z
fsevents-tools,https://github.com/ggreer/fsevents-tools,master,267,Like inotify-tools but for OS X's FSEvents,2023-11-17T07:43:20Z
TheRestOfYourLife,https://github.com/RayTracing/TheRestOfYourLife,master,255,DEPRECATED — Head to the raytracing.github.io repo for the new home,2023-08-22T18:28:37Z
px4_drv,https://github.com/nns779/px4_drv,develop,290,Unofficial Linux driver for PLEX PX4/PX5/PX-MLT series ISDB-T/S receivers (not V4L-DVB),2023-11-15T18:00:42Z
bitlbee-discord,https://github.com/sm00th/bitlbee-discord,master,277,Bitlbee plugin for Discord (http://discordapp.com),2023-11-01T15:01:01Z
bluebomb,https://github.com/Fullmetal5/bluebomb,master,273,A Bluetooth exploit for the Nintendo Wii.,2023-11-20T07:01:48Z
guff,https://github.com/silentbicycle/guff,master,269,a plot device,2023-09-14T08:49:10Z
rjm,https://github.com/rmitton/rjm,master,270,Various single-file C libraries.,2023-10-30T16:28:18Z
FFmpeg_Tutorial,https://github.com/yinwenjie/FFmpeg_Tutorial,master,282,FFmpeg工具和sdk库的使用demo,2023-11-21T07:55:27Z
filewatcher,https://github.com/santoru/filewatcher,master,274,A simple auditing utility for macOS,2023-10-02T11:38:42Z
injector,https://github.com/kubo/injector,master,382,Library for injecting a shared library into a Linux or Windows process,2023-11-21T08:52:46Z
breadwallet-core,https://github.com/breadwallet/breadwallet-core,develop,264,SPV bitcoin C library,2023-11-09T11:14:13Z
faxhell,https://github.com/ionescu007/faxhell,master,277,A Bind Shell Using the Fax Service and a DLL Hijack,2023-11-05T21:47:16Z
xcwd,https://github.com/schischi/xcwd,master,282,A simple tool that prints the current working directory of the currently focused window,2023-11-01T14:32:04Z
traffic-accounting-nginx-module,https://github.com/Lax/traffic-accounting-nginx-module,master,273,Monitor the incoming and outgoing traffic metrics in realtime for NGINX,2023-10-19T10:07:28Z
knot-resolver,https://github.com/CZ-NIC/knot-resolver,6.0,315,Knot Resolver - resolve DNS names like it's 2023,2023-11-21T15:00:07Z
awesome-csirt,https://github.com/Spacial/awesome-csirt,master,359,Awesome CSIRT is an curated list of links and resources in security and CSIRT daily activities.,2023-11-20T07:54:09Z
pg_hint_plan,https://github.com/ossc-db/pg_hint_plan,master,415,Give PostgreSQL ability to manually force some decisions in execution plans.,2023-11-16T17:40:10Z
2016_person_re-ID,https://github.com/layumi/2016_person_re-ID,master,264,TOMM2017 A Discriminatively Learned CNN Embedding for Person Re-identification,2023-08-18T06:43:35Z
picoc,https://github.com/jpoirier/picoc,master,315,A very small C interpreter,2023-11-15T04:16:07Z
ContactDiscoveryService,https://github.com/signalapp/ContactDiscoveryService,main,275,,2023-10-12T00:37:04Z
libpuzzle,https://github.com/jedisct1/libpuzzle,master,263,A library to quickly find visually similar images,2023-11-07T13:21:46Z
PS3HEN,https://github.com/PS3Xploit/PS3HEN,master,340,PS3 Homebrew ENabler [Supports 4.84 - 4.89 HFW],2023-11-16T08:41:03Z
virtual-reality,https://github.com/rokups/virtual-reality,master,273,Stealthy backdoor for Windows operating systems,2023-11-20T14:45:52Z
igbinary,https://github.com/phadej/igbinary,master,258,Igbinary is a drop in replacement for the standard php serializer.  Check https://github.com/igbinary/igbinary for the freshest version,2023-07-03T03:53:47Z
scrypt,https://github.com/pbhogan/scrypt,master,258,A Ruby gem with native C extension for the scrypt password hashing algorithm.,2023-09-19T14:26:17Z
raspi-kernel,https://github.com/jsandler18/raspi-kernel,master,274,,2023-10-28T13:38:21Z
ior,https://github.com/hpc/ior,main,326,IOR and mdtest,2023-11-21T06:24:56Z
v2ray.vpn,https://github.com/bannedbook/v2ray.vpn,master,327,"V2free for android, a V2ray and  Shadowsocks client with many builtin free servers.",2023-11-15T19:36:58Z
mingw-w64,https://github.com/mirror/mingw-w64,master,272,mingw-w64 Git mirror,2023-11-18T00:29:49Z
chain-reactor,https://github.com/redcanaryco/chain-reactor,master,274,Chain Reactor is an open source framework for composing executables that simulate adversary behaviors and techniques on Linux endpoints.,2023-11-16T15:04:16Z
SYNwall,https://github.com/SYNwall/SYNwall,master,262,A zero-configuration (IoT) firewall,2023-09-25T08:05:27Z
mach_star,https://github.com/rentzsch/mach_star,master,254,code injection and function overriding for Mac OS X,2023-08-23T08:56:07Z
PayDemo,https://github.com/codewpf/PayDemo,master,259,支付宝和微信支付两种方式集成,2023-10-03T13:48:29Z
CVE-2019-11932,https://github.com/dorkerdevil/CVE-2019-11932,master,264, double-free bug in WhatsApp exploit poc,2023-11-14T19:25:24Z
stm32f4_mpu9250,https://github.com/suhetao/stm32f4_mpu9250,master,274,"Access the data of 3-axis magnetometer and DMP from MPU9250 with SPI interface, All data fusion via EKF/UKF/CKF/SRCKF algorithm",2023-10-14T07:24:12Z
tinyEngine,https://github.com/sdlwlxf1/tinyEngine,master,292,my first cpu render engine. the main purpos is learning.,2023-11-22T02:53:37Z
wasm2cil,https://github.com/ericsink/wasm2cil,master,278,"A ""compiler"" that can take a WebAssembly/WASI module and convert it to a .NET assembly",2023-11-15T19:24:22Z
wavelib,https://github.com/rafat/wavelib,master,310,"C Implementation of 1D and 2D Wavelet Transforms (DWT,SWT and MODWT) along with 1D Wavelet packet Transform and 1D Continuous Wavelet Transform. ",2023-11-21T07:51:52Z
libcli,https://github.com/dparrish/libcli,stable,275,"Libcli provides a shared library for including a Cisco-like command-line interface into other software.  It's a telnet interface which supports command-line editing, history, authentication and callbacks for a user-definable function tree.",2023-11-17T00:40:31Z
bitrig,https://github.com/bitrig/bitrig,master,258,Bitrig base system repository.,2023-11-08T03:15:21Z
gctools,https://github.com/tmm1/gctools,master,258,profiler/logger/oobgc for rgengc in ruby 2.1,2023-04-04T10:28:42Z
lumpy-sv,https://github.com/arq5x/lumpy-sv,master,289,lumpy: a general probabilistic framework for structural variant discovery,2023-11-21T21:30:23Z
astera,https://github.com/tek256/astera,main,268,A C99 Cross Platform 2D Game Library,2023-10-26T18:08:59Z
lintel,https://github.com/dukebw/lintel,master,261,"A Python module to decode video frames directly, using the FFmpeg C API.",2023-11-01T15:52:31Z
mmg,https://github.com/MmgTools/mmg,master,318,open source software for bidimensional and tridimensional remeshing,2023-11-20T07:21:59Z
intel-vaapi-driver,https://github.com/intel/intel-vaapi-driver,master,285,VA-API user mode driver for Intel GEN Graphics family,2023-11-21T01:26:58Z
snek,https://github.com/keith-packard/snek,main,276,Snek programming language for tiny systems,2023-11-04T20:44:44Z
colorout,https://github.com/jalvesaq/colorout,master,274,Colorize R output in terminal emulators,2023-11-13T22:20:45Z
NetworkManager,https://github.com/NetworkManager/NetworkManager,main,316,Read-only Mirror of the freedesktop.org repository. Please make pull requests against freedesktop.org.,2023-11-18T20:22:52Z
awesome-php-ffi,https://github.com/gabrielrcouto/awesome-php-ffi,master,285,PHP FFI examples and use cases,2023-10-15T01:45:49Z
minix1,https://github.com/gdevic/minix1,master,309,"Original Minix 1 sources from the book ""Operating Systems: Design and Implementation"" 1st ed.",2023-11-17T09:58:05Z
openlaunchd,https://github.com/freebsd/openlaunchd,master,263,A launchd(8) port for non-Darwin systems,2023-11-06T13:43:56Z
video-compressor,https://github.com/lalongooo/video-compressor,master,261,Video compressor based in the Telegram for Android app source code.,2023-10-28T02:55:34Z
bnn-fpga,https://github.com/cornell-zhang/bnn-fpga,master,284,Binarized Convolutional Neural Networks on Software-Programmable FPGAs,2023-10-30T16:12:20Z
ec,https://github.com/system76/ec,master,298,System76 Open Source Embedded Controller,2023-11-02T01:30:48Z
LeechCore,https://github.com/ufrisk/LeechCore,master,354,LeechCore - Physical Memory Acquisition Library & The LeechAgent Remote Memory Acquisition Agent,2023-11-22T03:58:11Z
luastatus,https://github.com/shdown/luastatus,master,276,universal status bar content generator,2023-11-06T11:31:16Z
HIVIEW,https://github.com/openhisilicon/HIVIEW,master,301,Open multi-process software framework for hisilicon (海思) ipc/dvr/nvr/ebox,2023-11-19T02:38:40Z
SmartIMU,https://github.com/KitSprout/SmartIMU,master,268,Inertial Sensor Development Kit，STM32F411C、NRF52810、MPU9250、LPS22HB,2023-10-14T01:16:13Z
retrobot,https://github.com/rossimo/retrobot,master,269,,2023-11-04T19:40:58Z
unity-jsb,https://github.com/ialex32x/unity-jsb,master,321,It brings Javascript runtime capability to Unity3D by integrating QuickJS. ,2023-11-19T06:34:34Z
Cendric2,https://github.com/tizian/Cendric2,master,274,2D Game,2023-11-02T16:38:18Z
nudoku,https://github.com/jubalh/nudoku,master,294,ncurses based sudoku game,2023-11-03T17:24:48Z
riscv-crypto,https://github.com/riscv/riscv-crypto,main,324,RISC-V cryptography extensions standardisation work.,2023-11-12T19:53:52Z
CoreAR,https://github.com/sonsongithub/CoreAR,master,253,"AR(Augmented reality) framework for iOS, based on a visual code like ARToolKit",2023-09-15T03:06:42Z
sqltorrent,https://github.com/bittorrent/sqltorrent,master,265,,2023-10-23T11:10:36Z
coroutine,https://github.com/stevedekorte/coroutine,master,259,"C multiplatform coroutine implementation via ucontext, fibers or setjmp",2023-10-08T10:40:46Z
heimdal,https://github.com/heimdal/heimdal,master,297,Heimdal,2023-11-10T10:57:20Z
ccminer,https://github.com/cbuchner1/ccminer,master,260,Christian Buchner's & Christian H.'s CUDA miner project,2023-11-20T01:39:23Z
zerogw,https://github.com/tailhook/zerogw,master,252,"A fast HTTP/WebSocket to zeromq gateway (UNMAINTAINED, take a look at swindon web server instead)",2023-09-04T06:26:34Z
tobutobugirl,https://github.com/SimonLarsen/tobutobugirl,master,276,An arcade platformer homebrew game for the Game Boy,2023-09-07T19:58:24Z
stellarium-web-engine,https://github.com/Stellarium/stellarium-web-engine,master,341,JavaScript planetarium engine,2023-11-15T04:27:02Z
pg_jieba,https://github.com/jaiminpan/pg_jieba,master,304,Postgresql full-text search extension for chinese,2023-11-07T07:51:04Z
gsl-firmware,https://github.com/onitake/gsl-firmware,master,295,Firmware repository for Silead touchscreen controllers,2023-11-18T14:15:41Z
loopFindr,https://github.com/cyburgee/loopFindr,threaded-processing,259,Loop Findr,2023-10-26T19:04:13Z
nx-hbloader,https://github.com/switchbrew/nx-hbloader,master,307,Host process for loading Switch homebrew NROs,2023-11-18T04:59:56Z
ida-efiutils,https://github.com/snare/ida-efiutils,master,279,Some scripts for IDA Pro to assist with reverse engineering EFI binaries,2023-11-03T07:55:49Z
RF-Bridge-EFM8BB1,https://github.com/Portisch/RF-Bridge-EFM8BB1,master,281,Alternative Firmware for the Sonoff RF Bridge EFM8BB1 chip,2023-11-12T18:18:18Z
AiLight,https://github.com/stelgenhof/AiLight,develop,256,AiLight is a custom firmware for the esp8266 based Ai-Thinker (or equivalent) RGBW WiFi light bulbs,2023-06-22T21:54:02Z
nginx-tfs,https://github.com/alibaba/nginx-tfs,master,259,An Asynchronous Nginx module providing a RESTful API for TFS (Taobao File System).  ,2023-04-21T11:27:22Z
trolldrop,https://github.com/neonichu/trolldrop,master,261,:trollface: AirDrop trollfaces to everyone.,2023-08-27T18:19:53Z
sdk-bsp-stm32h750-realthread-artpi,https://github.com/RT-Thread-Studio/sdk-bsp-stm32h750-realthread-artpi,master,289,,2023-11-21T03:36:09Z
ruby-stemmer,https://github.com/aurelian/ruby-stemmer,master,252,Expose libstemmer_c to Ruby,2023-07-28T18:16:24Z
seabios,https://github.com/coreboot/seabios,master,328,mirror of seabios,2023-11-09T01:38:18Z
RapidDecoder,https://github.com/skgmn/RapidDecoder,master,258,Simplified bitmap decoding and scaling for Android,2023-11-22T03:25:04Z
qb64,https://github.com/Galleondragon/qb64,master,256,Automatically exported from code.google.com/p/qb64,2023-09-24T00:04:13Z
evmc,https://github.com/ethereum/evmc,master,300,EVMC – Ethereum Client-VM Connector API,2023-11-01T20:04:33Z
obs-vkcapture,https://github.com/nowrep/obs-vkcapture,master,414,OBS Linux Vulkan/OpenGL game capture,2023-11-18T17:42:25Z
stm32f103c8t6,https://github.com/ve3wwg/stm32f103c8t6,master,293,libopencm3 and FreeRTOS projects using the STM32F103C8T6 MCU,2023-11-19T12:16:56Z
LiPow-Firmware,https://github.com/AlexKlimaj/LiPow-Firmware,master,296,Lipo Battery Charger with USB C Power Delivery Based on the STM32G0,2023-11-08T16:27:39Z
Modbus-STM32-HAL-FreeRTOS,https://github.com/alejoseb/Modbus-STM32-HAL-FreeRTOS,master,377,"Modbus TCP and  RTU,  Master and Slave for STM32 using Cube HAL and FreeRTOS",2023-11-19T14:01:55Z
onload,https://github.com/Xilinx-CNS/onload,master,416,OpenOnload high performance user-level network stack,2023-11-21T18:29:30Z
wintun,https://github.com/WireGuard/wintun,master,358,Mirror only. Official repository is at https://git.zx2c4.com/wintun,2023-11-14T04:39:12Z
DMF,https://github.com/microsoft/DMF,master,289,Driver Module Framework,2023-11-20T14:45:47Z
MoSync,https://github.com/MoSync/MoSync,master,259,Cross-Platform SDK for mobile phones,2023-10-16T06:54:11Z
Buzz,https://github.com/buzz-lang/Buzz,master,274,A programming language designed for robot swarms.,2023-11-09T13:25:37Z
rtl8723de,https://github.com/smlinux/rtl8723de,current,259,Realtek RTL8723DE module for Linux,2023-09-26T12:57:08Z
libwacom,https://github.com/linuxwacom/libwacom,master,302,libwacom is a tablet description library,2023-11-15T11:55:34Z
enca,https://github.com/nijel/enca,master,268,Extremely Naive Charset Analyser,2023-11-19T09:05:43Z
ipp-crypto,https://github.com/intel/ipp-crypto,develop,294,,2023-11-15T07:20:34Z
raspi-cluster,https://github.com/rcarmo/raspi-cluster,master,256,Notes and scripts for setting up (yet another) Raspberry Pi computing cluster,2023-11-08T06:45:47Z
dapboot,https://github.com/devanlai/dapboot,master,293,DFU Bootloader for STM32 chips,2023-11-16T06:14:25Z
unshield,https://github.com/twogood/unshield,main,298,Tool and library to extract CAB files from InstallShield installers,2023-11-16T02:25:46Z
reF00D,https://github.com/dots-tb/reF00D,master,268,A vita plugin to run programs that do not get decrypted properly.,2023-10-13T14:17:58Z
streameye,https://github.com/ccrisan/streameye,master,264,A simple MJPEG streamer for Linux,2023-10-26T15:53:03Z
kernel_exploit_world,https://github.com/RKX1209/kernel_exploit_world,master,251,Tutorial for writing kernel exploits,2023-09-28T10:42:11Z
minidlna,https://github.com/azatoth/minidlna,master,277,MiniDLNA (aka ReadyDLNA) is server software with the aim of being fully compliant with DLNA/UPnP-AV clients. It is developed by a NETGEAR employee for the ReadyNAS product line,2023-10-17T08:19:07Z
Rhme-2016,https://github.com/Riscure/Rhme-2016,master,287,Rhme2 challenge (2016),2023-11-17T11:27:49Z
gtkhash,https://github.com/tristanheaven/gtkhash,master,323,A cross-platform desktop utility for computing message digests or checksums,2023-11-18T04:49:56Z
byopen,https://github.com/hack0z/byopen,master,287,🎉A dlopen library that bypasses mobile system limitation,2023-11-16T07:25:47Z
OpenNSL,https://github.com/Broadcom-Switch/OpenNSL,master,261,Open Network Switch Library,2023-11-18T03:30:14Z
cpmish,https://github.com/davidgiven/cpmish,master,280,An open source sort-of CP/M 2.2 distribution.,2023-11-11T15:12:38Z
uriparser,https://github.com/uriparser/uriparser,master,301, :hocho: Strictly RFC 3986 compliant URI parsing and handling library written in C89; moved from SourceForge to GitHub,2023-11-17T15:51:27Z
BFree,https://github.com/TUDSSL/BFree,main,268,BFree: Enabling Battery-free Sensor Prototyping with Python,2023-10-29T14:12:31Z
h2engine,https://github.com/fanchy/h2engine,master,258,H2服务器引擎架构是轻量级的，与其说是引擎，个人觉得称之为平台更为合适。因为它封装的功能少之又少，但是提供了非常简洁方便的扩展机制，使得可以用C++、python、lua、js、php来开发具体的服务器功能。H2引擎的灵感来源于web服务器Apache。,2023-11-06T02:28:29Z
videostreamer,https://github.com/horgh/videostreamer,master,263,Stream video (e.g. RTSP) to an HTML5 video element (MP4),2023-10-31T02:07:48Z
ESP32_Alexa,https://github.com/MrBuddyCasino/ESP32_Alexa,master,261,An Alexa Smart Speaker project for the ESP32.,2023-11-03T21:46:47Z
Repository Name,Repository URL,Default Branch,Star Count,Description,Update_date
uspi,https://github.com/rsta2/uspi,master,268,A bare metal USB driver for Raspberry Pi 1-3 written in C,2023-11-19T06:53:48Z
b3,https://github.com/ritschmaster/b3,master,370,i3 for Windows,2023-11-21T20:28:03Z
qemu-vm-escape,https://github.com/0xKira/qemu-vm-escape,master,269,,2023-11-22T08:02:51Z
