Repository Name,Repository URL,Default Branch,Star Count,Description,Update_date
vsxu,https://github.com/vovoid/vsxu,master,363,Visual programming language; Real-time OpenGL graphics; Embeddable; GPL/LGPL Licensed; Audio/Music Visualizer; Animation tool,2023-10-06T17:12:41Z
amatch,https://github.com/flori/amatch,master,369,Approximate String Matching library,2023-11-10T00:51:58Z
lightway-core,https://github.com/expressvpn/lightway-core,main,472,"Lightway Core is a modern VPN protocol by ExpressVPN, to deliver a VPN experience that’s faster, more secure, and more reliable.",2023-11-20T09:49:17Z
geoip-api-c,https://github.com/maxmind/geoip-api-c,main,364,DEPRECATED GeoIP Legacy C API,2023-11-21T16:22:21Z
openjdk-unofficial-builds,https://github.com/alexkasko/openjdk-unofficial-builds,master,355,"Unofficial OpenJDK installers for Windows, Linux and Mac OS X",2023-11-09T21:42:39Z
MonkVG,https://github.com/micahpearlman/MonkVG,master,369,MonkVG is an OpenVG 1.1 like vector graphics API implementation optimized for game use currently using an OpenGL ES backend that should be compatible with any HW that supports OpenGL ES 2.0 which includes most iOS and Android devices. ,2023-10-23T08:40:07Z
portability,https://github.com/gfx-rs/portability,master,371,Vulkan Portability Implementation,2023-10-22T21:07:32Z
jimtcl,https://github.com/msteveb/jimtcl,master,398,"Official repository of Jim Tcl, an open-source, small footprint implementation of Tcl",2023-11-17T21:34:19Z
kemon,https://github.com/didi/kemon,master,368,An Open-Source Pre and Post Callback-Based Framework for macOS Kernel Monitoring.,2023-11-03T09:41:04Z
libcsp,https://github.com/libcsp/libcsp,develop,432,Cubesat Space Protocol - A small network-layer delivery protocol designed for Cubesats,2023-11-21T01:17:47Z
atheme,https://github.com/atheme/atheme,master,375,Atheme IRC Services,2023-10-19T16:08:50Z
esptool-ck,https://github.com/igrr/esptool-ck,master,358,ESP8266 build/flash helper tool by Christian Klippel,2023-09-19T11:46:04Z
gba-remote-play,https://github.com/rodri042/gba-remote-play,master,401,📡 Stream Raspberry Pi games to a GBA via Link Cable.,2023-11-13T22:57:49Z
berry,https://github.com/berry-lang/berry,master,711,A ultra-lightweight embedded scripting language optimized for microcontrollers.,2023-11-19T19:57:01Z
libdxfrw,https://github.com/codelibs/libdxfrw,master,427,C++ library to read and write DXF/DWG files,2023-11-19T08:36:46Z
FirmAFL,https://github.com/zyw-200/FirmAFL,master,396,FIRM-AFL is the first high-throughput greybox fuzzer for IoT firmware. ,2023-11-21T11:39:21Z
terminal_minecraft,https://github.com/Kameldieb/terminal_minecraft,main,352,,2023-11-10T06:10:40Z
Sonic-Mania-Decompilation,https://github.com/Rubberduckycooly/Sonic-Mania-Decompilation,master,522,A complete decompilation of Sonic Mania (2017),2023-11-20T21:14:13Z
tolua_runtime,https://github.com/topameng/tolua_runtime,master,369,tolua runtime library,2023-11-08T08:32:31Z
ClangKit,https://github.com/macmade/ClangKit,main,357,"ClangKit provides an Objective-C frontend to LibClang. Source tokenization, diagnostics and fix-its are actually implemented.",2023-10-30T16:08:00Z
whois,https://github.com/rfc1036/whois,next,416,Intelligent WHOIS client,2023-11-21T01:43:36Z
bluez,https://github.com/bluez/bluez,master,532,Main BlueZ tree,2023-11-22T06:14:57Z
firmware,https://github.com/Coldcard/firmware,master,467,❄️ Firmware and simulator for Coldcard Hardware Wallet,2023-11-20T00:40:00Z
mettle,https://github.com/rapid7/mettle,master,400,"This is an implementation of a native-code Meterpreter, designed for portability, embeddability, and low resource utilization.",2023-11-07T11:10:54Z
Hamlib,https://github.com/Hamlib/Hamlib,master,504,"Ham radio control library for rigs, rotators, tuners, and amplifiers",2023-11-22T13:38:26Z
ngircd,https://github.com/ngircd/ngircd,master,392,"Free, portable and lightweight Internet Relay Chat server",2023-11-19T20:54:20Z
mmproxy,https://github.com/cloudflare/mmproxy,master,394,"mmproxy, the magical PROXY protocol gateway",2023-10-26T18:09:57Z
VisualUefi,https://github.com/ionescu007/VisualUefi,master,437,A project for allowing EDK-II Development with Visual Studio,2023-11-20T14:45:23Z
freertos-addons,https://github.com/michaelbecker/freertos-addons,master,408,Additions to FreeRTOS,2023-11-19T22:54:18Z
sgx-step,https://github.com/jovanbulck/sgx-step,master,400,A practical attack framework for precise enclave execution control,2023-11-10T09:07:30Z
UltraVNC,https://github.com/ultravnc/UltraVNC,main,574,"UltraVNC Server, UltraVNC Viewer and UltraVNC SC | Official repository: https://github.com/ultravnc/UltraVNC",2023-11-22T02:57:20Z
emu-ex-plus-alpha,https://github.com/Rakashazi/emu-ex-plus-alpha,master,471,Multi-platform computer & game console emulation system including supporting code (EmuFramework) and core engine (Imagine),2023-11-21T16:39:04Z
sandbox,https://github.com/cloudflare/sandbox,master,414,Simple Linux seccomp rules without writing any code,2023-11-20T12:43:18Z
diagnose-tools,https://github.com/alibaba/diagnose-tools,master,379,,2023-11-14T02:25:00Z
wingup,https://github.com/gup4win/wingup,master,392,WinGup - Generic Updater for Windows,2023-11-20T20:27:27Z
kernel-exploit-factory,https://github.com/bsauce/kernel-exploit-factory,main,982,Linux kernel CVE exploit analysis report and relative debug environment. You don't need to compile Linux kernel and configure your environment anymore. ,2023-11-21T21:52:23Z
mblaze,https://github.com/leahneukirchen/mblaze,master,405,Unix utilities to deal with Maildir,2023-11-21T09:58:10Z
eschalot,https://github.com/ReclaimYourPrivacy/eschalot,master,365,It is important to stress that we have not written this piece of software (see LICENSE),2023-11-05T16:57:07Z
pipe,https://github.com/cgaebel/pipe,master,363,A simple thread-safe FIFO in C.,2023-10-25T01:59:20Z
Vulkan-Loader,https://github.com/KhronosGroup/Vulkan-Loader,main,425,Vulkan Loader,2023-11-17T12:28:08Z
php-nsq,https://github.com/yunnian/php-nsq,master,352,"a php nsq client write by c extension,the fastest  nsq client",2023-11-14T16:12:39Z
libfvad,https://github.com/dpirch/libfvad,master,411,"Voice activity detection (VAD) library, based on WebRTC's VAD engine",2023-11-19T19:14:52Z
PcWeChatHooK,https://github.com/zmrbak/PcWeChatHooK,master,390,云课堂《2019 PC微信 探秘》示例代码,2023-10-08T11:24:04Z
firmware,https://github.com/UltimateHackingKeyboard/firmware,master,395,Ultimate Hacking Keyboard firmware,2023-11-17T17:44:47Z
dxgkrnl_hook,https://github.com/vmcall/dxgkrnl_hook,master,427,C++ graphics kernel subsystem hook,2023-11-21T11:44:35Z
link-grammar,https://github.com/opencog/link-grammar,master,373,The CMU Link Grammar natural language parser,2023-11-06T04:11:59Z
ccze,https://github.com/cornet/ccze,master,370,ccze,2023-11-19T17:01:37Z
stm8flash,https://github.com/vdudouyt/stm8flash,master,379,"program your stm8 devices with SWIM/stlinkv(1,2)",2023-11-22T05:51:04Z
horst,https://github.com/br101/horst,master,376,“horst” - lightweight IEEE802.11 wireless LAN analyzer with a text interface,2023-11-05T15:14:52Z
Ninja_UUID_Runner,https://github.com/boku7/Ninja_UUID_Runner,main,425,"Module Stomping, No New Thread, HellsGate syscaller, UUID Shellcode Runner for x64 Windows 10!",2023-11-20T14:46:42Z
lwext4,https://github.com/gkostka/lwext4,master,420,ext2/ext3/ext4 filesystem library for microcontrollers,2023-11-18T16:58:40Z
Kernels,https://github.com/ParRes/Kernels,default,390,This is a set of simple programs that can be used to explore the features of a parallel platform.,2023-11-22T02:52:50Z
bdr,https://github.com/2ndQuadrant/bdr,deprecated,355,"Bi-Directional Multi-Master Replication (BDR) for PostgreSQL, deprecated, please visit 2ndQuadrant website for latest BDR3",2023-11-02T12:47:21Z
WDL,https://github.com/justinfrankel/WDL,main,381,WDL (by Cockos) mirror,2023-11-15T20:07:22Z
switch-linux,https://github.com/fail0verflow/switch-linux,switch,350,Linux for the Switch,2023-10-14T13:41:48Z
neuzz,https://github.com/Dongdongshe/neuzz,master,384,neural network assisted fuzzer,2023-11-17T12:49:39Z
pulseaudio,https://github.com/pulseaudio/pulseaudio,master,390,Mirror of the PulseAudio sound server (for bug reports and pull requests go to the website!),2023-11-16T03:44:13Z
steamos_kernel,https://github.com/ValveSoftware/steamos_kernel,brewmaster-4.11,377,SteamOS kernel branches,2023-11-21T07:23:32Z
openpixelcontrol,https://github.com/zestyping/openpixelcontrol,master,349,A simple stream protocol for controlling arrays of RGB lights.,2023-09-30T16:56:46Z
spring12,https://github.com/picasso250/spring12,master,353,春节十二响,2023-11-14T08:48:50Z
rawrtc,https://github.com/rawrtc/rawrtc,master,362,WebRTC and ORTC with a little bit of RAWR!,2023-11-21T07:55:25Z
libiio,https://github.com/analogdevicesinc/libiio,main,427,A cross platform library for interfacing with local and remote Linux IIO devices,2023-11-17T10:04:11Z
KS_DAP_Wireless,https://github.com/Kevincoooool/KS_DAP_Wireless,master,439,STM32F103C8T6 无线有线DAP下载器，脱机（离线）烧录器，脱机下载器,2023-11-22T10:36:19Z
spawn,https://github.com/boku7/spawn,main,412,"Cobalt Strike BOF that spawns a sacrificial process, injects it with shellcode, and executes payload. Built to evade EDR/UserLand hooks by spawning sacrificial process with Arbitrary Code Guard (ACG), BlockDll, and PPID spoofing.",2023-11-22T10:03:16Z
pgsodium,https://github.com/michelp/pgsodium,main,480,Modern cryptography for PostgreSQL using libsodium.,2023-11-19T14:01:27Z
slurm,https://github.com/mattthias/slurm,upstream,372,yet another network load monitor,2023-11-08T08:23:24Z
Publications,https://github.com/REhints/Publications,master,355,Conference slides and White-papers ,2023-10-19T08:48:29Z
xuggle-xuggler,https://github.com/artclarke/xuggle-xuggler,master,348,Xuggle's Xuggler Java API for Video -- DEPRECATED,2023-11-15T08:43:32Z
prk_firmware,https://github.com/picoruby/prk_firmware,master,525,A keyboard firmware platform in PicoRuby,2023-11-19T07:31:40Z
vorbis,https://github.com/xiph/vorbis,master,415,Reference implementation of the Ogg Vorbis audio format.,2023-11-21T01:31:27Z
cstring,https://github.com/cloudwu/cstring,master,349,A simple C string lib,2023-11-17T02:37:36Z
eaccelerator,https://github.com/eaccelerator/eaccelerator,master,346,DEPRECATED: eAccelerator PHP opcode cache,2023-11-10T18:25:23Z
mnemosyne,https://github.com/mnemosyne-proj/mnemosyne,master,443,Mnemosyne: efficient learning with powerful digital flash-cards.,2023-11-20T21:44:55Z
Lumia950XLPkg,https://github.com/WOA-Project/Lumia950XLPkg,master,356,Non-EOL (yes!) AArch64 UEFI firmware for Lumia 950 / Lumia 950 XL,2023-11-21T14:52:14Z
console-client,https://github.com/pcloudcom/console-client,master,395,,2023-11-15T19:00:02Z
ctf,https://github.com/sixstars/ctf,master,350,"A writeup summary for CTF competitions, problems.",2023-10-19T11:42:17Z
fcitx-rime,https://github.com/fcitx/fcitx-rime,master,402,Rime support for Fcitx,2023-11-20T07:58:32Z
seahorn,https://github.com/seahorn/seahorn,main,397,SeaHorn Verification Framework,2023-11-20T18:50:55Z
nemo-extensions,https://github.com/linuxmint/nemo-extensions,master,379,A set of extensions for Nemo,2023-11-22T03:27:41Z
libcpuid,https://github.com/anrieff/libcpuid,master,405,a small C library for x86 CPU detection and feature extraction,2023-11-21T13:14:36Z
Somatic,https://github.com/ZackFreedman/Somatic,master,371,Open-hardware data glove,2023-11-14T21:50:26Z
tlsdate,https://github.com/ioerror/tlsdate,master,357,secure parasitic rdate replacement,2023-11-22T07:44:42Z
PuttyRider,https://github.com/seastorm/PuttyRider,master,357,Hijack Putty sessions in order to sniff conversation and inject Linux commands.,2023-10-04T20:05:09Z
dtach,https://github.com/crigler/dtach,master,429,A simple program that emulates the detach feature of screen,2023-11-11T01:18:00Z
ALL_SCHOOL_42,https://github.com/evgenkarlson/ALL_SCHOOL_42,master,561,"| SCHOOL_42_UPDATE 2020 | This repository contains ALL PROJECTS, TASKS AND SUBJECTS  OF THE MAIN PROGRAM OF LEARNING AT SCHOOL 42 ( Program | Course | Programing | Coding | School 42 | Ecole 42 | School 21 | Школа 42 | Школа 21 ). Этот репозиторий содержит все проекты и задания основной программы обучения Школы 42 и Школы 21",2023-11-22T11:18:15Z
Adafruit-Retrogame,https://github.com/adafruit/Adafruit-Retrogame,master,350,Raspberry Pi GPIO-to-virtual-keyboard utility for classic game emulators,2023-11-06T19:20:13Z
ShadowsocksRDroid,https://github.com/KagayamaKaede/ShadowsocksRDroid,master,343,A ShadowsocksR client for Android4.0+.Compatible Shadowsocks protocol and support some ShadowsocksR function.,2023-10-05T09:59:43Z
uopz,https://github.com/krakjoe/uopz,master,349,User Operations for Zend,2023-08-29T06:36:23Z
python-zstandard,https://github.com/indygreg/python-zstandard,main,424,Python bindings to the Zstandard (zstd) compression library,2023-11-20T01:33:09Z
SRB2,https://github.com/STJr/SRB2,master,398,SRB2 2.2 Public,2023-11-13T02:17:06Z
kdtree,https://github.com/jtsiomb/kdtree,master,370,A simple C library for working with KD-Trees,2023-11-17T12:11:44Z
PDFGen,https://github.com/AndreRenaud/PDFGen,master,434,Simple C PDF Writer/Generation library,2023-11-20T14:17:20Z
sof,https://github.com/thesofproject/sof,main,464,Sound Open Firmware,2023-11-19T03:38:01Z
midimonster,https://github.com/cbdevnet/midimonster,master,429,"Multi-protocol control & translation software (ArtNet, MIDI, OSC, sACN, ...)",2023-11-10T15:20:52Z
qemu_esp32,https://github.com/Ebiroll/qemu_esp32,master,403,Add tensilica esp32 cpu and a board to qemu and dump the rom to learn more about esp-idf,2023-11-05T12:58:24Z
arping,https://github.com/ThomasHabets/arping,arping-2.x,384,ARP Ping,2023-11-22T09:54:34Z
AVSample,https://github.com/yangkun19921001/AVSample,master,394,0 基础音视频进阶路线 (MediaCodec、FFmpeg、OpenCV、OpenGL、短视频 SDK、音视频播放器、webrtc),2023-11-17T10:34:49Z
stegdetect,https://github.com/abeluck/stegdetect,master,370,UNMAINTAINED. USE AT OWN RISK. Stegdetect is an automated tool for detecting steganographic content in images.,2023-11-22T06:17:25Z
shellcode,https://github.com/odzhan/shellcode,master,435,"Shellcodes for Windows/Linux/BSD running on x86, AMD64, ARM, ARM64",2023-11-20T12:43:13Z
pcre2,https://github.com/PCRE2Project/pcre2,master,631,PCRE2 development is now based here.,2023-11-21T21:21:15Z
bind9,https://github.com/isc-projects/bind9,main,487,"Mirror of https://gitlab.isc.org/isc-projects/bind9, please submit issues and PR/MRs in the GitLab. Any issues and PRs opened here will be closed without a comment.",2023-11-22T10:13:12Z
MPlayer-OSX-Extended,https://github.com/sttz/MPlayer-OSX-Extended,master,343,"MPlayer OSX Extended video player for Mac. Continuation of original MPlayer OSX project, using MPlayer command line as backend.",2023-11-04T16:22:28Z
tyton,https://github.com/nbulischeck/tyton,master,358,Kernel-Mode Rootkit Hunter,2023-11-21T03:01:49Z
kiss_sdl,https://github.com/actsl/kiss_sdl,master,375,Simple generic GUI widget toolkit for SDL2,2023-10-15T05:37:02Z
rvmi,https://github.com/mandiant/rvmi,master,352,rVMI - A New Paradigm For Full System Analysis,2023-10-11T17:48:53Z
rtl-entropy,https://github.com/pwarren/rtl-entropy,master,350,"An entropy generator using SDR peripherals, including rtl-sdr and BladeRF",2023-08-01T14:18:42Z
inject-assembly,https://github.com/kyleavery/inject-assembly,main,451,Inject .NET assemblies into an existing process,2023-11-22T13:02:41Z
ardrone_autonomy,https://github.com/AutonomyLab/ardrone_autonomy,indigo-devel,353,ROS driver for Parrot AR-Drone 1.0 and 2.0 quadrocopters,2023-10-29T21:43:02Z
kvmtool,https://github.com/kvmtool/kvmtool,master,431,Stand-alone Native Linux KVM Tool repo,2023-11-15T12:03:36Z
unrealircd,https://github.com/unrealircd/unrealircd,unreal60_dev,389,Official UnrealIRCd repository. Downloads are available from our site,2023-11-16T20:09:50Z
essentialmath,https://github.com/jvanverth/essentialmath,master,369,"Example code and libraries for the book ""Essential Mathematics for Games and Interactive Applications.""",2023-10-12T23:45:22Z
gozstd,https://github.com/valyala/gozstd,master,398,go wrapper for zstd,2023-11-13T02:16:47Z
artoolkitx,https://github.com/artoolkitx/artoolkitx,master,419,"artoolkitX, providing high-performance video acquisition, marker and texture tracking for augmented reality, in native code for iOS, Android, macOS, Windows, and Linux variants.",2023-11-22T09:46:43Z
atosl,https://github.com/facebookarchive/atosl,master,347,A partial replacement for Apple's atos tool for converting addresses within a binary file to symbols.,2023-11-14T16:52:41Z
sndfilter,https://github.com/velipso/sndfilter,master,401,"Algorithms for sound filters, like reverb, dynamic range compression, lowpass, highpass, notch, etc",2023-11-14T07:22:57Z
NtCall64,https://github.com/hfiref0x/NtCall64,master,480,Windows NT x64 syscall fuzzer,2023-11-20T14:45:29Z
xed,https://github.com/linuxmint/xed,master,400,"X-Apps [Text] Editor (Cross-DE, backward-compatible, GTK3, traditional UI)",2023-11-22T11:57:39Z
minicoro,https://github.com/edubart/minicoro,main,531,Single header stackful cross-platform coroutine library in pure C.,2023-11-19T00:27:29Z
subarufobrob,https://github.com/tomwimmenhove/subarufobrob,master,352,Hijack a Subaru's key fob and steal all the things,2023-11-12T03:56:54Z
forp-PHP-profiler,https://github.com/aterrien/forp-PHP-profiler,master,337,"A PHP profiler written in C. forp is a lightweight PHP extension which provides the full call stack of your script, with CPU and memory usage, in a plain PHP Array or JSON output.",2023-09-16T07:06:40Z
yi-hack-v5,https://github.com/alienatedsec/yi-hack-v5,master,600,"Even newer Custom Firmware for Xiaomi Cameras based on Hi3518ev200 Chipset. It includes free RTSP, ONVIF and other improvements based on the work by roleoroleo",2023-11-22T06:23:13Z
libbson,https://github.com/mongodb/libbson,master,343,ARCHIVED - libbson has moved to https://github.com/mongodb/mongo-c-driver/tree/master/src/libbson,2023-10-30T14:19:06Z
uraster,https://github.com/Steve132/uraster,master,343,Micro simple Rasterizer in a single C++11 header file.  ,2023-09-08T16:54:53Z
samplicator,https://github.com/sleinen/samplicator,master,366,"Send copies of (UDP) datagrams to multiple receivers, with optional sampling and spoofing",2023-11-14T04:09:16Z
pgquarrel,https://github.com/eulerto/pgquarrel,master,373,pgquarrel compares PostgreSQL database schemas (DDL),2023-10-22T16:33:05Z
Ekko,https://github.com/Cracked5pider/Ekko,main,561,Sleep Obfuscation,2023-11-21T09:05:08Z
static-arm-bins,https://github.com/therealsaumil/static-arm-bins,master,386,Statically compiled ARM binaries for debugging and runtime analysis,2023-11-08T10:41:11Z
jvmgcprof,https://github.com/twitter-archive/jvmgcprof,master,343,A simple utility for profile allocation and garbage collection activity in the JVM,2023-09-08T16:32:19Z
ply,https://github.com/wkz/ply,master,376,Light-weight Dynamic Tracer for Linux,2023-11-13T03:11:17Z
ERAM,https://github.com/Zero3K/ERAM,master,402,Open Source RAM Disk,2023-11-20T03:40:28Z
tls-fingerprinting,https://github.com/LeeBrotherston/tls-fingerprinting,master,364,TLS Fingerprinting,2023-11-05T16:10:09Z
py-tree-sitter,https://github.com/tree-sitter/py-tree-sitter,master,594,Python bindings to the Tree-sitter parsing library,2023-11-22T03:03:26Z
mate-desktop,https://github.com/mate-desktop/mate-desktop,master,393,Library with common API for various MATE modules,2023-11-15T20:42:17Z
framework,https://github.com/ice/framework,dev,340,Source code of Ice framework,2023-11-14T05:58:31Z
pbis-open,https://github.com/BeyondTrust/pbis-open,master,352,"BeyondTrust AD Bridge Open is an open-source community project sponsored by BeyondTrust Corporation. It is currently archived and will no longer receive updates. If you are interested in an Enterprise version of this project, please see our AD Bridge product.",2023-10-13T17:09:28Z
VEFontCache,https://github.com/hypernewbie/VEFontCache,main,345,Single-header minimalistic pragmatic GPU font rendering library.,2023-09-02T06:24:26Z
50AH-code,https://github.com/Macarse/50AH-code,master,347,50 Android Hacks book source code,2023-11-07T10:21:43Z
liberation-circuit,https://github.com/linleyh/liberation-circuit,master,381,"Trapped in a hostile computer system, you must make a way out - RTS/coding game",2023-11-16T00:09:00Z
fuse-overlayfs,https://github.com/containers/fuse-overlayfs,main,432, FUSE implementation for overlayfs,2023-11-22T07:13:25Z
como-lang-ng,https://github.com/analang/como-lang-ng,master,340,"como-lang-ng is now ana-lang, located at https://github.com/analang/ana",2023-08-31T16:06:49Z
speex,https://github.com/xiph/speex,master,390,"Speex voice codec mirror - THIS IS A MIRROR, DEVELOPMENT HAPPENS AT https://gitlab.xiph.org/xiph/speex",2023-11-22T06:47:51Z
doh,https://github.com/curl/doh,master,373,stand-alone application for DoH (DNS-over-HTTPS) name resolves and lookups,2023-10-31T15:30:55Z
hubicfuse,https://github.com/TurboGit/hubicfuse,master,336,Support for mounting HubiC drive in GNU/Linux ,2023-11-15T05:12:38Z
httptunnel,https://github.com/larsbrinkhoff/httptunnel,master,378,Bidirectional data stream tunnelled in HTTP requests.,2023-11-21T20:58:21Z
libmobi,https://github.com/bfabiszewski/libmobi,public,390,C library for handling Kindle (MOBI) formats of ebook documents,2023-11-22T13:05:49Z
fwup,https://github.com/fwup-home/fwup,main,358,Configurable embedded Linux firmware update creator and runner,2023-11-08T14:55:49Z
lwesp,https://github.com/MaJerle/lwesp,develop,412,Lightweight and versatile AT parser library for ESP8266 and ESP32 devices.,2023-11-07T06:22:30Z
O266player,https://github.com/TencentCloud/O266player,master,366,,2023-11-14T06:39:57Z
salt-states,https://github.com/SS-archive/salt-states,master,338,Collection of salt state files for use and testing,2023-10-09T04:11:49Z
linux-bpf-learning,https://github.com/nevermosby/linux-bpf-learning,master,440,learn how to use BPF/eBPF,2023-11-18T05:26:50Z
GP2040,https://github.com/FeralAI/GP2040,main,525,"Gamepad firmware for Raspberry Pi Pico and other RP2040 microcontrollers supporting Nintendo Switch, XInput and DirectInput",2023-11-22T12:29:56Z
esp32-80211-tx,https://github.com/Jeija/esp32-80211-tx,master,424, Send arbitrary IEEE 802.11 frames with Espressif's ESP32,2023-11-20T17:43:00Z
n64bootloader,https://github.com/clbr/n64bootloader,master,355,,2023-11-12T00:56:32Z
PESQ,https://github.com/ludlows/PESQ,master,434,PESQ (Perceptual Evaluation of Speech Quality) Wrapper for Python Users (narrow band and wide band),2023-11-22T10:58:49Z
ARM_NEON_2_x86_SSE,https://github.com/intel/ARM_NEON_2_x86_SSE,master,389,The platform independent header allowing to compile any C/C++ code containing ARM NEON intrinsic functions for x86 target systems using SIMD up to SSE4 intrinsic functions,2023-11-16T16:43:18Z
silentarmy,https://github.com/mbevand/silentarmy,master,341,Zcash miner optimized for AMD & Nvidia GPUs,2023-11-04T15:38:18Z
Audio-and-video-learning-materials,https://github.com/979451341/Audio-and-video-learning-materials,master,350,基于Android的音视频学习资料代码集合第一弹，这是第二弹https://github.com/979451341/AudioVideoStudyCodeTwo,2023-10-18T13:56:59Z
CVE-2022-0185,https://github.com/Crusaders-of-Rust/CVE-2022-0185,master,362,CVE-2022-0185,2023-11-16T12:09:17Z
weighttp,https://github.com/lighttpd/weighttp,master,343,weighttp on github for easier collaboration - main repo still on lighttpd.net,2023-11-07T12:34:38Z
Arduino_GFX,https://github.com/moononournation/Arduino_GFX,master,623,Arduino GFX developing for various color displays and various data bus interfaces,2023-11-21T18:29:07Z
sigrok-pico,https://github.com/pico-coder/sigrok-pico,main,596,Use a raspberry pi pico (rp2040) as a logic analyzer and oscilloscope with sigrok,2023-11-21T20:31:11Z
xilinx_axidma,https://github.com/bperez77/xilinx_axidma,master,405,"A zero-copy Linux driver and a userspace interface library for Xilinx's AXI DMA and VDMA IP blocks. These serve as bridges for communication between the processing system and FPGA programmable logic fabric, through one of the DMA ports on the Zynq processing system. Distributed under the MIT License.",2023-11-20T06:23:55Z
Cadence,https://github.com/falkTX/Cadence,master,361,Collection of tools useful for audio production,2023-11-16T14:51:47Z
wordset-dictionary,https://github.com/wordset/wordset-dictionary,master,429,The Open Source Dictionary,2023-11-16T13:54:22Z
swift-nio-ssl,https://github.com/apple/swift-nio-ssl,main,373,"TLS Support for SwiftNIO, based on BoringSSL.",2023-10-30T21:25:33Z
Blackb0x,https://github.com/NSSpiral/Blackb0x,main,442,Apple TV 2/3 Jailbreak,2023-11-22T02:47:18Z
commonmarker,https://github.com/gjtorikian/commonmarker,main,382,Ruby wrapper for the comrak (CommonMark parser) Rust crate,2023-11-19T15:21:17Z
BlackHoodie-2018-Workshop,https://github.com/tharina/BlackHoodie-2018-Workshop,master,342,Slides and challenges for my binary exploitation workshop at BlackHoodie 2018.,2023-09-28T10:56:03Z
sljit,https://github.com/zherczeg/sljit,master,495,Platform independent low-level JIT compiler,2023-11-13T04:40:11Z
malheur,https://github.com/rieck/malheur,master,354,A Tool for Automatic Analysis of Malware Behavior,2023-11-15T08:12:06Z
StepFC,https://github.com/dustpg/StepFC,master,413,Make FC(NES) Emulator Step-by-Step 一步一步模拟红白机,2023-11-06T12:42:03Z
mastering-stm32,https://github.com/cnoviello/mastering-stm32,master,387,"Repository of all examples presented in the ""Mastering STM32"" book",2023-11-21T20:15:29Z
fastwsgi,https://github.com/jamesroberts/fastwsgi,main,388,An ultra fast WSGI server for Python 3,2023-11-21T17:00:56Z
